id	url	title	abstract
0e33b08be8b2b2af9f2159d5e21995ce	https://www.biorxiv.org/content/10.1101/2020.06.09.137935v1	"Fast isolation of sub-nanomolar affinity alpaca nanobody against the Spike RBD of SARS-CoV-2 by combining bacterial display and a simple single-step density gradient selection"	"Despite the worldwide efforts to avoid disease progression of COVID-19 into a severe acute respiratory syndrome and avoid its severe impact on health systems; the situation remains critical. Effective diagnosis, treatment, and prophylactic measures are required to meet the worldwide demand: recombinant antibodies such as alpaca Nanobodies fulfill these requirements. Here, we develop a fast track for nanobody isolation against the receptor-binding-domain (RBD) SARS-CoV-2 Spike protein following an optimized immunization, efficient construction of the VHH library for E. coli surface display, and single-step selection of high-affinity nanobodies using a simple density gradient centrifugation of the bacterial library. Following this procedure, we isolate and characterize an alpaca Nanobody against Spike RBD of SARS-CoV-2 in the sub-nanomolar range.\n\n### Competing Interest Statement\n\nThe authors have declared no competing interest."
ace9df61927f26f1de66b1519bcd4c57	http://doi.org/10.1371/journal.pone.0008818	"Llama Single Domain Antibodies Specific for the 7 Botulinum Neurotoxin Serotypes as Heptaplex Immunoreagents"	"Background There are currently 7 known serotypes of botulinum neurotoxin (BoNT) classified upon non-cross reactivity of neutralizing immunoglobulins. Non-neutralizing immunoglobulins, however, can exhibit cross-reactivities between 2 or more serotypes, particularly mosaic forms, which can hamper the development of highly specific immunoassays, especially if based on polyclonal antisera. Here we employ facile recombinant antibody technology to subtractively select ligands to each of the 7 BoNT serotypes, resulting in populations with very high specificity for their intended serotype.  Methods and Findings A single llama was immunized with a cocktail of 7 BoNT toxoids to generate a phage display library of single domain antibodies (sdAb, VHH or nanobodies) which were selected on live toxins. Resulting sdAb were capable of detecting both toxin and toxin complex with the best combinations able to detect 100s-10s of pg per 50 \u00b5L sample in a liquid bead array. The most sensitive sdAb were combined in a heptaplex assay to identify each of the BoNT serotypes in buffer and milk and to a lesser extent in carrot juice, orange juice and cola. Several anti-A(1) sdAb recognized A2 complex, showing that subtype cross-reactivity within a serotype was evident. Many of our sdAb could act as both captor and tracer for several toxin and toxin complexes suggesting sdAb can be used as architectural probes to indicate BoNT oligomerisation. Six of 14 anti-A clones exhibited inhibition of SNAP-25 cleavage in the neuro-2A assay indicating some sdAb had toxin neutralizing capabilities. Many sdAb were also shown to be refoldable after exposure to high temperatures in contrast to polyclonal antisera, as monitored by circular dichroism.  Conclusions Our panel of molecularly flexible antibodies should not only serve as a good starting point for ruggedizing assays and inhibitors, but enable the intricate architectures of BoNT toxins and complexes to be probed more extensively."
3616ed657c05a3ff8bde03fc56e89578	http://doi.org/10.1038/s41598-017-14512-8	"Structural basis of nanobody-mediated blocking of BtuF, the cognate substrate-binding protein of the Escherichia coli vitamin B12 transporter BtuCD"	"Bacterial ABC importers catalyze the uptake of essential nutrients including transition metals and metal-containing co-factors. Recently, an IgG antibody targeting the external binding protein of the Staphylococcus aureus Mn(II) ABC importer was reported to inhibit transport activity and reduce bacterial cell growth. We here explored the possibility of using alpaca-derived nanobodies to inhibit the vitamin B12 transporter of Escherichia coli, BtuCD-F, as a model system by generating nanobodies against the periplasmic binding protein BtuF. We isolated six nanobodies that competed with B12 for binding to BtuF, with inhibition constants between 10\u22126 and 10\u22129\u2009M. Kinetic characterization of the nanobody-BtuF interactions revealed dissociation half-lives between 1.6 and 6\u2009minutes and fast association rates between 104 and 106\u2009M\u22121s\u22121. For the tightest-binding nanobody, we observed a reduction of in vitro transport activity of BtuCD-F when an excess of nanobody over B12 was used. The structure of BtuF in complex with the most effective nanobody Nb9 revealed the molecular basis of its inhibitory function. The CDR3 loop of Nb9 reached into the substrate-binding pocket of BtuF, preventing both B12 binding and BtuCD-F complex formation. Our results suggest that nanobodies can mediate ABC importer inhibition, providing an opportunity for novel antibiotic strategies."
81f138f72738603fbae08b97efcda4fe	http://doi.org/10.1371/journal.pone.0178469	"Selection and characterization of specific nanobody against bovine virus diarrhea virus (BVDV) E2 protein"	"Bovine viral diarrhea-mucosal disease (BVD-MD) is caused by bovine viral diarrhea virus (BVDV), and results in abortion, stillbirth, and fetal malformation in cows. Here, we constructed the phage display vector pCANTAB 5E-VHH and then transformed it into Escherichia coli TG1-competent cells, to construct an initial anti-BVDV nanobody gene library. We obtained a BVDV-E2 antigen epitope bait protein by prokaryotic expression using the nucleotide sequence of the E2 gene of the BVDV-NADL strain published in GenBank. Phage display was used to screen the anti-BVDV nanobody gene library. We successfully constructed a high quality phage display nanobody library, with an initial library capacity of 4.32\u00d7105. After the rescue of helper phage, the titer of the phage display nanobody library was 1.3\u00d71011. The BVDV-E2 protein was then expressed in Escherichia coli (DE3), and a 49.5 kDa band was observed with SDS-PAGE analysis that was consistent with the expected nanobody size. Thus, we were able to isolate one nanobody that exhibits high affinity and specificity against BVDV using phage display techniques. This isolated nanobody was then used in Enzyme Linked Immunosorbent Assay and qRT-PCR, and ELISA analyses of BVDV infection of MDBK cells indicated that the nanobodies exhibited good antiviral effect."
62917fbb7f3fc583623aabdece3306e5	https://www.sciencedirect.com/science/article/pii/S0304416517302003?via%3Dihub	"Exploiting sequence and stability information for directing nanobody stability engineering"	"Variable domains of camelid heavy-chain antibodies, commonly named nanobodies, have high biotechnological potential. In view of their broad range of a\u2026"
0860a8ef23447488c0a71269ca6ea637	http://doi.org/10.1038/s41598-018-20599-4	"Application of Assisted Design of Antibody and Protein Therapeutics (ADAPT) improves efficacy of a Clostridium difficile toxin A single-domain antibody"	"Assisted Design of Antibody and Protein Therapeutics (ADAPT) is an affinity maturation platform interleaving predictions and testing that was previously validated on monoclonal antibodies (mAbs). This study expands the applicability of ADAPT to single-domain antibodies (sdAbs), a promising class of recombinant antibody-based biologics. As a test case, we used the camelid\u00a0sdAb A26.8, a VHH that binds Clostridium difficile toxin A (TcdA) relatively weakly but displays a reasonable level of TcdA neutralization. ADAPT-guided A26.8 affinity maturation resulted in an improvement of one order of magnitude by point mutations only, reaching an equilibrium dissociation constant (KD) of 2\u2009nM, with the best binding mutants having similar or improved stabilities relative to the parent sdAb. This affinity improvement generated a 6-fold enhancement of efficacy at the cellular level; the A26.8 double-mutant T56R,T103R neutralizes TcdA cytotoxicity with an IC50 of 12\u2009nM. The designed mutants with increased affinities are predicted to establish novel electrostatic interactions with the antigen. Almost full additivity of mutation effects is observed, except for positively charged residues introduced at adjacent positions. Furthermore, analysis of false-positive predictions points to general directions for improving the ADAPT\u00a0platform. ADAPT guided the efficacy enhancement of an anti-toxin sdAb, an alternative therapeutic modality for C. difficile."
1a4fe3c54a7a6b5d14e5085a9e0a0ee0	http://doi.org/10.1038/s41598-018-29508-1	"Neutralization of Jun\u00edn virus by single domain antibodies targeted against the nucleoprotein"	"The syndrome viral haemorrhagic fever (VHF) designates a broad range of diseases that are caused by different viruses including members of the family Arenaviridae. Prophylaxis for Argentine Haemorrhagic Fever (AHF), caused by the arenavirus Jun\u00edn (JUNV), has been achieved by the use of a live attenuated vaccine, named Candid#1. The standard treatment of AHF is transfusion of convalescent human plasma. Our aim was to develop an alternative and safer treatment for AHF based on the use of virus-neutralizing single domain antibodies (VHHs). We describe the first reported VHHs directed against an arenavirus. These VHHs could neutralize Candid#1 by altering virion binding/fusion. Surprisingly, the neutralizing VHHs appeared to be specific for the viral nucleoprotein (N) that is not known to be involved in arenavirus entry. Candid#1 VHH-escape viruses had acquired a predicted N-glycosylation site in the surface glycoprotein GP1 that is present in highly pathogenic JUNV strains. Accordingly, the Candid#1-neutralizing VHHs could not neutralize pathogenic JUNV strains, but they could still bind to cells infected with a pathogenic strain or the escape mutant viruses. These results show that the attenuated strains of JUNV can be potently neutralized by nucleoprotein-specific VHHs."
d54e8aaf74a7ce2f767035cfb34bbc77	http://doi.org/10.1186/s12934-017-0837-z	"Selection, characterization, and thermal stabilization of llama single domain antibodies towards Ebola virus glycoprotein"	"A key advantage of recombinant antibody technology is the ability to optimize and tailor reagents. Single domain antibodies (sdAbs), the recombinantly produced variable domains derived from camelid and shark heavy chain antibodies, provide advantages of stability and solubility and can be further engineered to enhance their properties. In this study, we generated sdAbs specific for Ebola virus envelope glycoprotein (GP) and increased their stability to expand their utility for use in austere locals. Ebola virus is extremely virulent and causes fatal hemorrhagic fever in ~\u00a050 percent of the cases. The viral GP binds to host cell receptors to facilitate viral entry and thus plays a critical role in pathogenicity. An immune phage display library containing more than 107 unique clones was developed from a llama immunized with a combination of killed Ebola virus and recombinantly produced GP. We panned the library to obtain GP binding sdAbs and isolated sdAbs from 5 distinct sequence families. Three GP binders with dissociation constants ranging from ~\u00a02 to 20\u00a0nM, and melting temperatures from ~\u00a057 to 72\u00a0\u00b0C were selected for protein engineering in order to increase their stability through a combination of consensus sequence mutagenesis and the addition of a non-canonical disulfide bond. These changes served to increase the melting temperatures of the sdAbs by 15\u201317\u00a0\u00b0C. In addition, fusion of a short positively charged tail to the C-terminus which provided ideal sites for the chemical modification of these sdAbs resulted in improved limits of detection of GP and Ebola virus like particles while serving as tracer antibodies. SdAbs specific for Ebola GP were selected and their stability and functionality were improved utilizing protein engineering. Thermal stability of antibody reagents may be of particular importance when operating in austere locations that lack reliable refrigeration. Future efforts can evaluate the potential of these isolated sdAbs as candidates for diagnostic or therapeutic applications for Ebola."
062cb15afcf39eba805a0cfb59dfb639	https://www.sciencedirect.com/science/article/abs/pii/S0041010114003559?via%3Dihub	"Bactrian camel nanobody-based immunoassay for specific and sensitive detection of Cry1Fa toxin"	"The variable domain of the heavy-chain-only antibody (VHH) or nanobody (Nb), derived from camelids, begins to play an important role on the detection \u2026"
d3c5f09e4271f08cd4c8dada6294f89a	https://www.sciencedirect.com/science/article/abs/pii/S0165247817301165?via%3Dihub	"Selection of similar single domain antibodies from two immune VHH libraries obtained from two alpacas by using different selection methods"	"The two most used methods to select camelid single-domain antibody-fragments (VHHs) are: displaying their repertoires on the surface of filamentous ba\u2026"
7078feaa9b411de80ffa5c7222fa0600	http://doi.org/10.3390/toxins10040142	"Camelid Single-Domain Antibodies (VHHs) against Crotoxin: A Basis for Developing Modular Building Blocks for the Enhancement of Treatment or Diagnosis of Crotalic Envenoming"	"Toxic effects triggered by crotalic envenoming are mainly related to crotoxin (CTX), composed of a phospholipase A2 (CB) and a subunit with no toxic activity (CA). Camelids produce immunoglobulins G devoid of light chains, in which the antigen recognition domain is called VHH. Given their unique characteristics, VHHs were selected using Phage Display against CTX from Crotalus durissus terrificus. After three rounds of biopanning, four sequence profiles for CB (KF498602, KF498603, KF498604, and KF498605) and one for CA (KF498606) were revealed. All clones presented the VHH hallmark in FR2 and a long CDR3, with the exception of KF498606. After expressing pET22b-VHHs in E. coli, approximately 2 to 6 mg of protein per liter of culture were obtained. When tested for cross-reactivity, VHHs presented specificity for the Crotalus genus and were capable of recognizing CB through Western blot. KF498602 and KF498604 showed thermostability, and displayed affinity constants for CTX in the micro or nanomolar range. They inhibited in vitro CTX PLA2 activity, and CB cytotoxicity. Furthermore, KF498604 inhibited the CTX-induced myotoxicity in mice by 78.8%. Molecular docking revealed that KF498604 interacts with the CA\u2013CB interface of CTX, seeming to block substrate access. Selected VHHs may be alternatives for the crotalic envenoming treatment."
c59794b50f76553e0e026fc1ede1f8b2	http://doi.org/10.1126/sciadv.aas9667	"Chimeric camel/human heavy-chain antibodies protect against MERS-CoV infection"	"Middle East respiratory syndrome coronavirus (MERS-CoV) continues to cause outbreaks in humans as a result of spillover events from dromedaries. In contrast to humans, MERS-CoV\u2013exposed dromedaries develop only very mild infections and exceptionally potent virus-neutralizing antibody responses. These strong antibody responses may be caused by affinity maturation as a result of repeated exposure to the virus or by the fact that dromedaries\u2014apart from conventional antibodies\u2014have relatively unique, heavy chain\u2013only antibodies (HCAbs). These HCAbs are devoid of light chains and have long complementarity-determining regions with unique epitope binding properties, allowing them to recognize and bind with high affinity to epitopes not recognized by conventional antibodies. Through direct cloning and expression of the variable heavy chains (VHHs) of HCAbs from the bone marrow of MERS-CoV\u2013infected dromedaries, we identified several MERS-CoV\u2013specific VHHs or nanobodies. In vitro, these VHHs efficiently blocked virus entry at picomolar concentrations. The selected VHHs bind with exceptionally high affinity to the receptor binding domain of the viral spike protein. Furthermore, camel/human chimeric HCAbs\u2014composed of the camel VHH linked to a human Fc domain lacking the CH1 exon\u2014had an extended half-life in the serum and protected mice against a lethal MERS-CoV challenge. HCAbs represent a promising alternative strategy to develop novel interventions not only for MERS-CoV but also for other emerging pathogens."
34c435a98248884896fb260e7cdc5902	https://www.cell.com/cell/fulltext/S0092-8674(18)30844-4?_returnURL=https%3A%2F%2Flinkinghub.elsevier.com%2Fretrieve%2Fpii%2FS0092867418308444%3Fshowall%3Dtrue	"A Synthetic Bacterial Cell-Cell Adhesion Toolbox for Programming Multicellular Morphologies and Patterns"	"The development of a genetically encoded toolkit of surface-bound nanobodies and antigens\nin E.\u00a0coli allows for precise manipulation of cell-cell adhesion and rational design\nof diverse self-assembled multicellular patterns and morphologies."
abd4a1129547a3c24a88158844e6b0f0	http://doi.org/10.22038/IJBMS.2018.26778.6557	"Development of specific nanobodies (VHH) for CD19 immuno-targeting of human B-lymphocytes"	"Objective(s): CD19 is a transmembrane glycoprotein of immunoglobulin superfamily. In order to treat lymphoma, monoclonal antibodies (mAb) can target different antigens, including CD19, CD20 and CD22 on the surface of B-cells. Along with biotechnology progress, a new generation of antibodies is introduced, with the purpose of eliminating the defects of the previous generation. Among the most developed one are nanobodies (Nb).\u00a0 Nbs are a unique kind of camelid single domain antibody fragments with a broad range of medical applications. Unique physicochemical properties of Nbs have made them ideal candidates for therapeutic and diagnostic applications. Materials and Methods: An immune gene library was created, and several CD19 specific Nbs were selected through antigen panning process, and their molecular properties as well as specificity, sensitivity, affinity and immunoreactivity against CD19 positive and negative cells were evaluated. Results: The Nb library was prepared with 7.2 x107 members. We managed to isolate a panel of CD19-specific Nbs after the last round of selection with the affinity of isolated Nbs being estimated at the standard range of 15-35 nM.\u00a0 Sequence analysis of positive clones was indicative of the fact that 12 variable sequences were confirmed. Of all these 12 clones, 2 clones with the greatest level signal in ELISA underwent subsequent analysis. Our sequencing results indicated high sequence homology (approximately 90%) between the Nb and Homa variable immunoglobulin domains.Conclusion: Specific Nbs possess the potential to be used as novel therapeutic approaches in order to treat autoimmune diseases and B-cell lymphoma."
df278e9fc461f3e5edf7093de8f91568	http://doi.org/10.1038/s41598-017-18146-8	"Functional characterization and discovery of modulators of SbMATE, the agronomically important aluminium tolerance transporter from Sorghum bicolor"	"About 50% of the world\u2019s arable land is strongly acidic (pH\u2009\u2264\u20095). The low pH solubilizes root-toxic ionic aluminium (Al3+) species from clay minerals, driving the evolution of counteractive adaptations in cultivated crops. The food crop Sorghum bicolor upregulates the membrane-embedded transporter protein SbMATE in its roots. SbMATE mediates efflux of the anionic form of the organic acid, citrate, into the soil rhizosphere, chelating Al3+ ions and thereby imparting Al-resistance based on excluding Al+3 from the growing root tip. Here, we use electrophysiological, radiolabeled, and fluorescence-based transport assays in two heterologous expression systems to establish a broad substrate recognition profile of SbMATE, showing the proton and/or sodium-driven transport of 14C-citrate anion, as well as the organic monovalent cation, ethidium, but not its divalent analog, propidium. We further complement our transport assays by measuring substrate binding to detergent-purified SbMATE protein. Finally, we use the purified membrane protein as an antigen to discover native conformation-binding and transport function-altering nanobodies using an animal-free, mRNA/cDNA display technology. Our results demonstrate the utility of using Pichia pastoris as an efficient eukaryotic host to express large quantities of functional plant transporter proteins. The nanobody discovery approach is applicable to other non-immunogenic plant proteins."
1c2223d4374102537dd2da1f40dae846	https://www.sciencedirect.com/science/article/abs/pii/S0003986112001622?via%3Dihub	"A bacterial-two-hybrid selection system for one-step isolation of intracellularly functional Nanobodies"	"Camel single-domain antibody fragments or Nanobodies, are practical in a wide range of applications. Their unique biochemical and biophysical properti\u2026"
af4843655d8240e294afdfbbc10e41fc	https://www.sciencedirect.com/science/article/abs/pii/S0147651318300058?via%3Dihub	"Microcystin-LR nanobody screening from an alpaca phage display nanobody library and its expression and application"	"Microcystin-LR (MC-LR) is a type of biotoxin that pollutes the ecological environment and food. The study aimed to obtain new nanobodies from phage na\u2026"
9fa2c3078d0495be4ed729a58842a7ba	http://doi.org/10.3390/ijms18071507	"Rapid and Direct VHH and Target Identification by Staphylococcal Surface Display Libraries"	"Unbiased and simultaneous identification of a specific antibody and its target antigen has been difficult without prior knowledge of at least one interaction partner. Immunization with complex mixtures of antigens such as whole organisms and tissue extracts including tumoral ones evokes a highly diverse immune response. During such a response, antibodies are generated against a variety of epitopes in the mixture. Here, we propose a surface display design that is suited to simultaneously identify camelid single domain antibodies and their targets. Immune libraries of single-domain antigen recognition fragments from camelid heavy chain-only antibodies (VHH) were attached to the peptidoglycan of Gram-positive Staphylococcus aureus employing its endogenous housekeeping sortase enzyme. The sortase transpeptidation reaction covalently attached the VHH to the bacterial peptidoglycan. The reversible nature of the reaction allowed the recovery of the VHH from the bacterial surface and the use of the VHH in downstream applications. These staphylococcal surface display libraries were used to rapidly identify VHH as well as their targets by immunoprecipitation (IP). Our novel bacterial surface display platform was stable under harsh screening conditions, allowed fast target identification, and readily permitted the recovery of the displayed VHH for downstream analysis."
f4c010b21c21500a1993052f75b36ebf	https://www.sciencedirect.com/science/article/abs/pii/S0161589016301857?via%3Dihub	"Identification and characterization of a novel nanobody against human placental growth factor to modulate angiogenesis"	"Placental growth factor (PlGF), a member of vascular endothelial growth factors (VEGF) family, is considered as an important antigen associated with p\u2026"
d23dd2212dc4dbedbd084bfc69b020b4	http://doi.org/10.1186/s12934-017-0630-z	"Joining the in vitro immunization of alpaca lymphocytes and phage display: rapid and cost effective pipeline for sdAb synthesis"	"Camelids possess unique functional heavy chain antibodies, which can be produced and modified in vitro as a single domain antibody (sdAb or nanobody) with full antigen binding ability. Production of sdAb in conventional manner requires active immunization of Camelidae animal, which is laborious, time consuming, costly and in many cases not feasible (e.g. in case of highly toxic or infectious antigens). In this study, we describe an alternative pipeline that includes in vitro stimulation of na\u00efve alpaca B-lymphocytes by antigen of interest (in this case endothelial cell binding domain of OspA of Borrelia) in the presence of recombinant alpaca interleukins 2 and 4, construction of sdAb phage library, selection of antigen specific sdAb expressed on phages (biopanning) and confirmation of binding ability of sdAb to the antigen. By joining the in vitro immunization and the phage display ten unique phage clones carrying sdAb were selected. Out of ten, seven sdAb showed strong antigen binding ability in phage ELISA. Furthermore, two soluble forms of sdAb were produced and their differential antigen binding affinity was measured with bio-layer interferometry. A proposed pipeline has potential to reduce the cost substantially required for maintenance of camelid herd for active immunization. Furthermore, in vitro immunization can be achieved within a week to enrich mRNA copies encoding antigen-specific sdAbs in B cell. This rapid and cost effective pipeline can help researchers to develop efficiently sdAb for diagnostic and therapeutic purposes."
f2e4f260d0eab80fda7198541b545f21	http://doi.org/10.1093/abbs/gmx037	"camel anti-lysozyme CDR3 only domain antibody selected from phage display VHH library acts as potent lysozyme inhibitor"	"Abstract. Mimetics of antibody-binding sites represent particularly interesting targets, however they are difficult to identify. In most cases, naturally derive"
