id	url	title	abstract
7ae258181ebc06534c549dc8837b6f76	http://doi.org/10.18632/oncotarget.16708	"Non-invasive assessment of murine PD-L1 levels in syngeneic tumor models by nuclear imaging with nanobody tracers"	"  //      Katrijn Broos 1,  * , Marleen Keyaerts 2,  3,  * , Quentin Lecocq 1 , Dries Renmans 1 , Tham Nguyen 2,  4 , David Escors 6 , Adrian Liston 7,  8 , Geert Raes 4,  5,  * , Karine Breckpot 1,  *  and Nick Devoogdt 2,  *     1 Laboratory of Molecular and Cellular Therapy (LMCT), Vrije Universiteit Brussel, B-1090 Brussels, Belgium    2  In Vivo  Cellular and Molecular Imaging Laboratory (ICMI), Vrije Universiteit Brussel, B-1090 Brussels, Belgium    3 Nuclear Medicine Department, UZ Brussel, B-1090 Brussels, Belgium    4 Unit of Cellular and Molecular Immunology (CMIM), Vrije Universiteit Brussel, B-1050 Brussels, Belgium    5 Myeloid Cell Immunology Laboratory, VIB Inflammation Research Center, 9052 Ghent, Belgium    6 Immunomodulation Group, Navarrabiomed-Biomedical Research Centre, 31008 Pamplona, Navarra, Spain    7 Department of Microbiology and Immunology, University of Leuven (KU Leuven), 3000  Leuven, Belgium    8 VIB Center for Brain and Disease Research, 3000 Leuven, Belgium    * These authors contributed equally to this work   Correspondence to:   Nick Devoogdt, email:  ndevoogd@vub.ac.be     Keywords:  immune checkpoints, programmed death-1/programmed death-ligand 1, biomarker, nanobodies, SPECT/CT imaging    Received:  January 21, 2017&nbsp;&nbsp;&nbsp;&nbsp;&nbsp; Accepted:  March 19, 2017&nbsp;&nbsp;&nbsp;&nbsp;&nbsp; Published:  March 30, 2017     ABSTRACT   Blockade of the inhibitory PD-1/PD-L1 immune checkpoint axis is a promising cancer treatment. Nonetheless, a significant number of patients and malignancies do not respond to this therapy. To develop a screen for response to PD-1/PD-L1 inhibition, it is critical to develop a non-invasive tool to accurately assess dynamic immune checkpoint expression. Here we evaluated non-invasive SPECT/CT imaging of PD-L1 expression, in murine tumor models with varying PD-L1 expression, using high affinity PD-L1-specific nanobodies (Nbs). We generated and characterized 37 Nbs recognizing mouse PD-L1. Among those, four Nbs C3, C7, E2 and E4 were selected and evaluated for preclinical imaging of PD-L1 in syngeneic mice. We performed SPECT/CT imaging in wild type versus PD-L1 knock-out mice, using Technetium-99m ( 99m Tc) labeled Nbs. Nb C3 and E2 showed specific antigen binding and beneficial biodistribution. Through the use of CRISPR/Cas9 PD-L1 knock-out TC-1 lung epithelial cell lines, we demonstrate that SPECT/CT imaging using Nb C3 and E2 identifies PD-L1 expressing tumors, but not PD-L1 non-expressing tumors, thereby confirming the diagnostic potential of the selected Nbs. In conclusion, these data show that Nbs C3 and E2 can be used to non-invasively image PD-L1 levels in the tumor, with the strength of the signal correlating with PD-L1 levels. These findings warrant further research into the use of Nbs as a tool to image inhibitory signals in the tumor environment. "
73852c0b9953f67b863f0f313b7f25c4	http://doi.org/10.1021/acs.jafc.7b04923	"Phage-Mediated Competitive Chemiluminescent Immunoassay for Detecting Cry1Ab Toxin by Using an Anti-Idiotypic Camel Nanobody"	"Cry toxins have been widely used in genetically modified organisms for pest control, raising public concern regarding their effects on the natural environment and food safety. In this work, a phage..."
f78a7293216f86495d0f1bac939ffa81	https://www.sciencedirect.com/science/article/abs/pii/S1046592817303042?via%3Dihub	"Generation of Nanobodies against SlyD and development of tools to eliminate this bacterial contaminant from recombinant proteins"	"The gene for a protein domain, derived from a tumor marker, fused to His tag codons and under control of a T7 promotor was expressed in E.\u00a0coli strain\u2026"
10ab58fd004c004622e5060e94365f38	https://www.jbc.org/article/S0021-9258(20)31685-9/fulltext	"The Molecular Mechanism of Shiga Toxin Stx2e Neutralization by a Single-domain Antibody Targeting the Cell Receptor-binding Domain"	"Shiga toxin Stx2e is the major known agent that causes edema disease in newly weaned\npigs. This severe disease is characterized by neurological disorders, hemorrhagic\nlesions, and frequent fatal outcomes. Stx2e consists of an enzymatically active A\nsubunit and five B subunits that bind to a specific glycolipid receptor on host cells.\nIt is evident that antibodies binding to the A subunit or the B subunits of Shiga\ntoxin variants may have the capability to inhibit their cytotoxicity. Here, we report\nthe discovery and characterization of a VHH single domain antibody (nanobody) isolated\nfrom a llama phage display library that confers potent neutralizing capacity against\nStx2e toxin."
8380a600c44ff44ceeb6b2d9661795ee	http://doi.org/10.1038/srep07373	"Llama immunization with full-length VAR2CSA generates cross-reactive and inhibitory single-domain antibodies against the DBL1X domain"	"VAR2CSA stands today as the leading vaccine candidate aiming to protect future pregnant women living in malaria endemic areas against the severe clinical outcomes of pregnancy associated malaria (PAM). The rational design of an efficient VAR2CSA-based vaccine relies on a profound understanding of the molecular interactions associated with P. falciparum infected erythrocyte sequestration in the placenta. Following immunization of a llama with the full-length VAR2CSA recombinant protein, we have expressed and characterized a panel of 19 nanobodies able to recognize the recombinant VAR2CSA as well as the surface of erythrocytes infected with parasites originating from different parts of the world. Domain mapping revealed that a large majority of nanobodies targeted DBL1X whereas a few of them were directed towards DBL4\u03b5, DBL5\u03b5 and DBL6\u03b5. One nanobody targeting the DBL1X was able to recognize the native VAR2CSA protein of the three parasite lines tested. Furthermore, four nanobodies targeting DBL1X reproducibly inhibited CSA adhesion of erythrocytes infected with the homologous NF54-CSA parasite strain, providing evidences that DBL1X domain is part or close to the CSA binding site. These nanobodies could serve as useful tools to identify conserved epitopes shared between different variants and to characterize the interactions between VAR2CSA and CSA."
d7d03324273e75cdd22af91e8f64de80	http://doi.org/10.1371/journal.pone.0084981	"Utilizing Nanobody Technology to Target Non-Immunodominant Domains of VAR2CSA"	"Placental malaria is a major health problem for both pregnant women and their fetuses in malaria endemic regions. It is triggered by the accumulation of Plasmodium falciparum-infected erythrocytes (IE) in the intervillous spaces of the placenta and is associated with foetal growth restriction and maternal anemia. IE accumulation is supported by the binding of the parasite-expressed protein VAR2CSA to placental chondroitin sulfate A (CSA). Defining specific CSA-binding epitopes of VAR2CSA, against which to target the immune response, is essential for the development of a vaccine aimed at blocking IE adhesion. However, the development of a VAR2CSA adhesion-blocking vaccine remains challenging due to (i) the large size of VAR2CSA and (ii) the extensive immune selection for polymorphisms and thereby non-neutralizing B-cell epitopes. Camelid heavy-chain-only antibodies (HcAbs) are known to target epitopes that are less immunogenic to classical IgG and, due to their small size and protruding antigen-binding loop, able to reach and recognize cryptic, conformational epitopes which are inaccessible to conventional antibodies. The variable heavy chain (VHH) domain is the antigen-binding site of camelid HcAbs, the so called Nanobody, which represents the smallest known (15 kDa) intact, native antigen-binding fragment. In this study, we have used the Nanobody technology, an approach new to malaria research, to generate small and functional antibody fragments recognizing unique epitopes broadly distributed on VAR2CSA."
a73fd872d43d5e5cc6dde86915d753a5	http://doi.org/10.18632/oncotarget.17390	"Differentially expressed proteins in glioblastoma multiforme identified with a nanobody-based anti-proteome approach and confirmed by OncoFinder as possible tumor-class predictive biomarker candidates"	"  //      Ivana Jov\u010devska 1 , Neja Zupanec 1 , \u017diga Urlep 2 , Andrej Vrani\u010d 3 , Bo&scaron;tjan Matos 4 , Clara Limbaeck Stokin 5 , Serge Muyldermans 6 , Michael P. Myers 7 , Anton A. Buzdin 8,  9 , Ivan Petrov 10,  11  and Radovan Komel 1     1 Medical Center for Molecular Biology, Institute of Biochemistry, Faculty of Medicine, University of Ljubljana, Ljubljana, Slovenia    2 Center for Functional Genomics and Bio-Chips, Institute of Biochemistry, Faculty of Medicine, University of Ljubljana, Ljubljana, Slovenia    3 Department of Neurosurgery, Foundation Rothschild, Paris, France    4 Department of Neurosurgery, University Clinical Center, Ljubljana, Slovenia    5 Institute of Histopathology, Charing Cross Hospital, London, United Kingdom    6 Cellular and Molecular Immunology, Vrije Universiteit Brussel, Brussels, Belgium    7 International Center for Genetic Engineering and Biotechnology, Trieste, Italy    8 First Oncology Research and Advisory Center, Moscow, Russia    9 National Research Center 'Kurchatov Institute', Center of Convergence of Nano-, Bio-, Information and Cognitive Sciences and Technologies, Moscow, Russia    10 Center for Biogerontology and Regenerative Medicine, IC Skolkovo, Moscow, Russia    11 Moscow Institute of Physics and Technology, Moscow, Russia   Correspondence to:   Radovan Komel, email:  radovan.komel@mf.uni-lj.si    Ivana Jov\u010devska, email:  ivana.jovcevska@mf.uni-lj.si     Keywords:  glioblastoma multiforme, biomarkers, nanobodies, cancer biology, OncoFinder    Received:  September 14, 2016&emsp;&emsp;&emsp;&emsp; Accepted:  April 10, 2017&emsp;&emsp;&emsp;&emsp; Published:  April 24, 2017     ABSTRACT   Glioblastoma multiforme is the most frequent primary malignancy of the central nervous system. Despite remarkable progress towards an understanding of tumor biology, there is no efficient treatment and patient outcome remains poor. Here, we present a unique anti-proteomic approach for selection of nanobodies specific for overexpressed glioblastoma proteins. A phage-displayed nanobody library was enriched in protein extracts from NCH644 and NCH421K glioblastoma cell lines. Differential ELISA screenings revealed seven nanobodies that target the following antigens: the ACTB/NUCL complex, VIM, NAP1L1, TUFM, DPYSL2, CRMP1, and ALYREF. Western blots showed highest protein up-regulation for ALYREF, CRMP1, and VIM. Moreover, bioinformatic analysis with the OncoFinder software against the complete &ldquo;Cancer Genome Atlas&rdquo; brain tumor gene expression dataset suggests the involvement of different proteins in the WNT and ATM pathways, and in Aurora B, Sem3A, and E-cadherin signaling. We demonstrate the potential use of  NAP1L1 ,  NUCL ,  CRMP1 ,  ACTB , and  VIM  for differentiation between glioblastoma and lower grade gliomas, with  DPYSL2  as a promising &ldquo;glioma  versus  reference&rdquo; biomarker. A small scale validation study confirmed significant changes in mRNA expression levels of  VIM ,  DPYSL2 ,  ACTB  and  TRIM28 . This work helps to fill the information gap in this field by defining novel differences in biochemical profiles between gliomas and reference samples. Thus, selected genes can be used to distinguish glioblastoma from lower grade gliomas, and from reference samples. These findings should be valuable for glioblastoma patients once they are validated on a larger sample size. "
ea53425051518ba1c639953dc4aac457	https://www.sciencedirect.com/science/article/pii/S0166685113000881?via%3Dihub	"The structure of the D3 domain of Plasmodium falciparum myosin tail interacting protein MTIP in complex with a nanobody"	"Apicomplexan parasites enter host cells by many sophisticated steps including use of an ATP-powered invasion machinery. The machinery consists of mult\u2026"
5976d08f1c8fa4c2bd706d69c85d4342	http://doi.org/10.3390/toxins8040099	"Structural Characterization of Humanized Nanobodies with Neutralizing Activity against the Bordetella pertussis CyaA-Hemolysin: Implications for a Potential Epitope of Toxin-Protective Antigen"	"Previously, the 126-kDa CyaA-hemolysin (CyaA-Hly) fragment cloned from Bordetella pertussis\u2014the causative agent of whooping cough\u2014and functionally expressed in Escherichia coli was revealed as a key determinant for CyaA-mediated hemolysis against target erythrocytes. Here, phagemid-transfected E. coli clones producing nanobodies capable of binding to CyaA-Hly were selected from a humanized-camel VH/VHH phage-display library. Subsequently verified for binding activities by indirect ELISA and Western blotting, four CyaA-Hly-specific nanobodies were obtained and designated according to the presence/absence of VHH-hallmark amino acids as VHH2, VH5, VH18 and VHH37. In vitro neutralization assay revealed that all four ~17-kDa His-tagged VH/VHH nanobodies, in particular VHH37, which were over-expressed as inclusions and successfully unfolded-refolded, were able to effectively inhibit CyaA-Hly-mediated hemolysis. Phage-mimotope searching revealed that only peptides with sequence homologous to Linker 1 connecting Blocks I and II within the CyaA-RTX subdomain were able to bind to these four CyaA-Hly-specific nanobodies. Structural analysis of VHH37 via homology modeling and intermolecular docking confirmed that this humanized nanobody directly interacts with CyaA-RTX/Linker 1 through multiple hydrogen and ionic bonds. Altogether, our present data demonstrate that CyaA-RTX/Linker 1 could serve as a potential epitope of CyaA-protective antigen that may be useful for development of peptide-based pertussis vaccines. Additionally, such toxin-specific nanobodies have a potential for test-driven development of a ready-to-use therapeutic in passive immunization for mitigation of disease severity."
8b1908114a1eadbdcf022a44ee9a8577	http://doi.org/10.1093/protein/gzr037	"Development of Cys38 knock-out and humanized version of NbAahII10 nanobody with improved neutralization of AahII Scorpion toxin"	"Abstract. During scorpion envenoming, highly toxic small polypeptides of the venom diffuse rapidly within the victim, causing serious medical problems. Nanobodi"
aa96fedb20daa92e1d6b40d400f8b056	https://www.sciencedirect.com/science/article/abs/pii/S0022283608000405?via%3Dihub	"Disulfide Bond Introduction for General Stabilization of Immunoglobulin Heavy-Chain Variable Domains"	"Several antibody fragment engineering techniques aim at intrinsic stability enhancement, but are not applied in a truly generic way. Here, a strategy \u2026"
f2f84ca3ac6c397b04ba73fe768de752	https://www.jbc.org/article/S0021-9258(20)33977-6/fulltext	"Single-domain antibodies pinpoint potential targets within Shigella invasion plasmid antigen D of the needle tip complex for inhibition of type III secretion"	"Numerous Gram-negative pathogens infect eukaryotes and use the type III secretion\nsystem (T3SS) to deliver effector proteins into host cells. One important T3SS feature\nis an extracellular needle with an associated tip complex responsible for assembly\nof a pore-forming translocon in the host cell membrane. Shigella spp. cause shigellosis,\nalso called bacillary dysentery, and invade colonic epithelial cells via the T3SS.\nThe tip complex of Shigella flexneri contains invasion plasmid antigen D (IpaD), which\ninitially regulates secretion and provides a physical platform for the translocon\npore."
0ab6573a1d99b2a5fe04de798ff5d168	http://doi.org/10.1007/s12010-018-2762-y	"Rapid and Sensitive Detection of Staphylococcal Enterotoxin B by Recombinant Nanobody Using Phage Display Technology"	"Staphylococcal enterotoxin B, from Staphylococcus aureus (S. aureus), is one of the most potent bacterial superantigens with profound toxic effects on the immune system. It is associated with food poisoning, toxic shock, atopic dermatitis, asthma, and nasal polyps in humans. The current diagnostic methods for staphylococcal enterotoxin are mainly based on traditional monoclonal antibodies which hardly meet the requirements for clinical applications, and hybridoma clones lose their ability to secrete antibodies during time. The present study investigates the development of a novel, highly specific, low-cost, and sensitive nanobody capable of being used in immunoassays for Staphylococcal enterotoxin B (SEB) detection in suspicious foods. For this purpose, Camelus dromedarius was immunized against SEB toxin. After obtaining acceptable titration, a high-quality phage display nanobody library (4\u2009\u00d7\u20091010\u00a0PFU/ml) was constructed. High-affinity SEB-specific nanobodies were retrieved from constructed libraries. After phage rescue and five round of biopanning, clone screening was performed by phage ELISA. Recombinant nanobodies which were expressed from C7 and C21 clone showed the highest affinity for SEB. The presence of high quality and pure nanobody band at ~\u200915\u00a0kDa was confirmed by SDS-PAGE and western blotting. The affinity constant which was measured by ELISA was calculated to be around 10\u22129\u00a0M. The results suggest that the proposed detection method by nanobodies is an alternative diagnostic tool enabling a rapid, inexpensive, and specific detection of the SEB."
b83bc61ecbdbe690cbc7111c4463de16	https://www.jbc.org/article/S0021-9258(20)47471-X/fulltext	"Interactions between Metal-binding Domains Modulate Intracellular Targeting of Cu(I)-ATPase ATP7B, as Revealed by Nanobody Binding *"	"Background: Copper regulates the intracellular localization of a copper transporter\nATP7B; the molecular mechanism of this process is unclear.Results: Nanobodies detected\ntransient interactions between the metal-binding domains (MBDs) and modulated intracellular\nlocalization of ATP7B.Conclusion: MBDs 1\u20133 form a dynamic structural module of ATP7B\ninvolved in regulation of trafficking.Significance: Nanobodies demonstrate the importance\nof protein dynamics in ATP7B localization in cells."
2335b08f8c9a915ba0f51562102341d3	https://www.jbc.org/article/S0021-9258(19)46993-7/fulltext	"Generation and Characterization of Small Single Domain Antibodies Inhibiting Human Tumor Necrosis Factor Receptor 1 *"	"Background: Several anti-TNF biologicals are available to treat autoimmune diseases.\nHowever, selective TNFR1 inhibition is advisable, thereby reducing the pro-inflammatory\nTNF/TNFR1 signaling, while the good immunomodulatory TNF/TNFR2 signaling is preserved.Results:\nWe generated and characterized an anti-TNFR1 Nanobody, TNF Receptor-One Silencer (TROS).Conclusion:\nTROS inhibits inflammation in vitro, ex vivo, and in vivo.Significance: Anti-TNFR1\ntherapies are potential novel treatments against autoimmune diseases."
e27f24be7f845c1e41499423c22a4c00	http://doi.org/10.1021/ac502390c	"Nanobody-Based Enzyme Immunoassay for Aflatoxin in Agro-Products with High Tolerance to Cosolvent Methanol"	"A phage-displayed library of variable domain of heavy chain of the heavy chain antibody (VHH) or nanobody (Nb) was constructed after immunizing an alpaca with aflatoxin B1 (AFB1) conjugated with bo..."
3f4276b64baa90c9096b232aabf860f0	http://doi.org/10.1186/s12951-015-0091-7	"Characterization and applications of Nanobodies against human procalcitonin selected from a novel na\u00efve Nanobody phage display library"	"Nanobodies (Nbs) are single-domain antigen-binding fragments derived from the camelids heavy-chain only antibodies (HCAbs). Their unique advantageous properties make Nbs highly attractive in various applications. The general approach to obtain Nbs is to isolate them from immune libraries by phage display technology. However, it is unfeasible when the antigens are toxic, lethal, transmissible or of low immunogenicity. Na\u00efve libraries could be an alternative way to solve the above problems. We constructed a large camel na\u00efve phage display Nanobody (Nb) library with great diversity. The generated library contains to 6.86\u2009\u00d7\u20091011 clones and to our best of knowledge, this is the biggest na\u00efve phage display Nb library. Then Nbs against human procalcitonin (PCT) were isolated from this library. These Nbs showed comparable affinity and antigen-binding thermostability at 37\u00b0C and 60\u00b0C compared to the PCT Nbs from an immune phage-displayed library. Furthermore, two PCT Nbs that recognize unique epitopes on PCT have been successfully applied to develop a sandwich enzyme-linked immunosorbent assay (ELISA) to detect PCT, which showed a linear working range from 10-1000\u00a0ng/mL of PCT. We have constructed a large and diverse na\u00efve phage display Nb library, which potentially functioning as a good resource for selecting antigen-binders with high quality. Moreover, functional Nbs against PCT were successfully characterized and applied, providing great values on medical application."
f4d9c4e302d962113a1d879873e6686d	http://doi.org/10.1002/mbo3.581	"Sensitive detection of Bacillus thuringiensis Cry1B toxin based on camel single\u2010domain antibodies"	"In this study, we have successfully constructed an immune phage display library against Cry1B, meanwhile, three different types of nanobodies (Nbs) with distinguished specificity, high affinity, outs..."
075a5af4d3de36f25d7095b4babf6c66	http://doi.org/10.1371/journal.pone.0115893	"Generation of a Nanobody Targeting the Paraflagellar Rod Protein of Trypanosomes"	"Trypanosomes are protozoan parasites that cause diseases in humans and livestock for which no vaccines are available. Disease eradication requires sensitive diagnostic tools and efficient treatment strategies. Immunodiagnostics based on antigen detection are preferable to antibody detection because the latter cannot differentiate between active infection and cure. Classical monoclonal antibodies are inaccessible to cryptic epitopes (based on their size-150 kDa), costly to produce and require cold chain maintenance, a condition that is difficult to achieve in trypanosomiasis endemic regions, which are mostly rural. Nanobodies are recombinant, heat-stable, small-sized (15 kDa), antigen-specific, single-domain, variable fragments derived from heavy chain-only antibodies in camelids. Because of numerous advantages over classical antibodies, we investigated the use of nanobodies for the targeting of trypanosome-specific antigens and diagnostic potential. An alpaca was immunized using lysates of Trypanosoma evansi. Using phage display and bio-panning techniques, a cross-reactive nanobody (Nb392) targeting all trypanosome species and isolates tested was selected. Imunoblotting, immunofluorescence microscopy, immunoprecipitation and mass spectrometry assays were combined to identify the target recognized. Nb392 targets paraflagellar rod protein (PFR1) of T. evansi, T. brucei, T. congolense and T. vivax. Two different RNAi mutants with defective PFR assembly (PFR2RNAi and KIF9BRNAi) were used to confirm its specificity. In conclusion, using a complex protein mixture for alpaca immunization, we generated a highly specific nanobody (Nb392) that targets a conserved trypanosome protein, i.e., PFR1 in the flagella of trypanosomes. Nb392 is an excellent marker for the PFR and can be useful in the diagnosis of trypanosomiasis. In addition, as demonstrated, Nb392 can be a useful research or PFR protein isolation tool."
5e4525fb801c21bbe7ecaffde2b84b0e	http://doi.org/10.1038/s41598-017-01456-2	"Identification of a nanobody specific to human pulmonary surfactant protein A"	"Nanobody (Nb) is a promising vector for targeted drug delivery. This study aims to identify an Nb that can specifically target the lung by binding human pulmonary surfactant protein A (SP-A). Human lung frozen tissue sections were used for 3 rounds of biospanning of our previously constructed Nb library for rat SP-A to establish a sub-library of Nb, which specifically bound human lung tissues. Phage-ELISA was performed to screen the sub-library to identify Nb4, which specifically bound human SP-A. The binding affinity Kd of Nb4 to recombinant human SP-A was 7.48\u2009\u00d7\u200910\u22127 M. Nb4 (19\u2009kDa) was stable at 30\u2009\u00b0C\u201337\u2009\u00b0C and pH 7.0\u20137.6 and specifically bound the SP-A in human lung tissue homogenates, human lung A549 cells, and human lung tissues, whereas didn\u2019t react with human liver L-02 cells, kidney 293T cells, and human tissues from organs other than the lung. Nb4 accumulated in the lung of nude mice 5\u2009minutes after a tail vein injection of Nb4 and was excreted 3\u2009hours. Short-term exposure (one month) to Nb4 didn\u2019t cause apparent liver and kidney toxicity in rats, whereas 3-month exposure resulted in mild liver and kidney injuries. Nb4 may be a promising vector to specifically deliver drugs to the lung."
