id	url	title	abstract
8f59e99f4c2cbaa81c13046d5608ebc8	https://www.biorxiv.org/content/10.1101/2020.06.09.143438v1	"Potent synthetic nanobodies against SARS-CoV-2 and molecular basis for neutralization"	"SARS-CoV-2, the Covid-19 causative virus, adheres to human cells through binding of its envelope Spike protein to the receptor ACE2. The Spike receptor-binding domain (S-RBD) mediates this key event and thus is a primary target for therapeutic neutralizing antibodies to mask the ACE2-interacting interface. Here, we generated 99 synthetic nanobodies (sybodies) using ribosome and phage display. The best sybody MR3 binds the RBD with K D of 1.0 nM and neutralizes SARS-CoV-2 pseudovirus with IC50 of 0.40 \u03bcg mL-1. Crystal structures of two sybody-RBD complexes reveal a common neutralizing mechanism through which the RBD-ACE2 interaction is competitively inhibited by sybodies. The structures allowed the rational design of a mutant with higher affinity and improved neutralization efficiency by \u223c24-folds, lowering the IC50 from 12.32 to 0.50 \u03bcg mL-1. Further, the structures explain the selectivity of sybodies between SARS-CoV strains. Our work presents an alternative approach to generate neutralizers against newly emerged viruses.\n\nOne sentence summary Structural and biochemical studies revealed the molecular basis for the neutralization mechanism of in vitro -selected and rationally designed nanobody neutralizers for SARS-CoV-2 pseudovirus.\n\n### Competing Interest Statement\n\nThe authors have declared no competing interest."
f37841a42bb396017befc7bd782b3246	https://www.biorxiv.org/content/10.1101/2020.04.16.045419v2	"Sybodies targeting the SARS-CoV-2 receptor-binding domain"	"The COVID-19 pandemic, caused by the novel coronavirus SARS-CoV-2, has resulted in a global health and economic crisis of unprecedented scale. The high transmissibility of SARS-CoV-2, combined with a lack of population immunity and prevalence of severe clinical outcomes, urges the rapid development of effective therapeutic countermeasures. Here, we report the generation of synthetic nanobodies, known as sybodies, against the receptor-binding domain (RBD) of SARS-CoV-2. In an expeditious process taking only twelve working days, sybodies were selected entirely in vitro from three large combinatorial libraries, using ribosome and phage display. We obtained six strongly enriched sybody pools against the isolated RBD and identified 63 unique anti-RBD sybodies which also interact in the context of the full-length SARS-CoV-2 spike ectodomain. Among the selected sybodies, six were found to bind to the viral spike with double-digit nanomolar affinity, and five of these also showed substantial inhibition of RBD interaction with human angiotensin-converting enzyme 2 (ACE2). Additionally, we identified a pair of anti-RBD sybodies that can simultaneously bind to the RBD. It is anticipated that compact binders such as these sybodies could feasibly be developed into an inhalable drug that can be used as a convenient prophylaxis against COVID-19. Moreover, generation of polyvalent antivirals, via fusion of anti-RBD sybodies to additional small binders recognizing secondary epitopes, could enhance the therapeutic potential and guard against escape mutants. We present full sequence information and detailed protocols for the identified sybodies, as a freely accessible resource.\n\n### Competing Interest Statement\n\nIwan Zimmermann, Pascal Egloff and Markus A. Seeger are founders and shareholders of Linkster Therapeutics AG."
8eec309d3ecc253880848cd133856ff9	https://patents.google.com/patent/CN112094342A/en	"Alpaca source nano antibody combined with SARS-CoV-2RBD \n     "	"\n     The present disclosure relates to alpaca-derived antibodies or antigen-binding fragments thereof that bind to SARS-CoV-2RBD, and in particular, to alpaca-derived nanobodies or dual epitope-specific antibodies or antigen-binding fragments thereof consisting of the same that can bind to the receptor-binding Region (RBD) of the novel coronavirus (SARS-CoV-2) with high affinity, which can be used for the prevention, treatment and/or diagnosis of SARS-CoV-2 infection. \n     \n   "
60f354b0e1d30d9eb94fade4cfd0a074	https://patentimages.storage.googleapis.com/64/4a/88/b2848f579117cb/CN106380517B.pdf	""	""
3317f8378b4ed879278e184fd59d9e10	http://doi.org/10.1021/acs.analchem.7b01221	"Comparison of Three Antihapten VHH Selection Strategies for the Development of Highly Sensitive Immunoassays for Microcystins"	"Owing to their reproducibility, stability, and cost-effective production, the recombinant variable domains of heavy-chain-only antibodies (VHHs) are becoming a salient option as immunoassay reagent..."
fb587a796f844d1cd80fc64472ed34df	https://www.nature.com/articles/s41467-020-18387-8	"Humanized single domain antibodies neutralize SARS-CoV-2 by targeting the spike receptor binding domain"	"Severe acute respiratory syndrome coronavirus 2 (SARS-CoV-2) spreads worldwide and leads to an unprecedented medical burden and lives lost. Neutralizing antibodies provide efficient blockade for viral infection and are a promising category of biological therapies. Here, using SARS-CoV-2 spike receptor-binding domain (RBD) as a bait, we generate a panel of humanized single domain antibodies (sdAbs) from a synthetic library. These sdAbs reveal binding kinetics with the equilibrium dissociation constant (KD) of 0.99\u201335.5\u2009nM. The monomeric sdAbs show half maximal neutralization concentration (EC50) of 0.0009\u20130.07\u2009\u00b5g/mL and 0.13\u20130.51\u2009\u00b5g/mL against SARS-CoV-2 pseudotypes, and authentic SARS-CoV-2, respectively. Competitive ligand-binding experiments suggest that the sdAbs either completely block or significantly inhibit the association between SARS-CoV-2 RBD and viral entry receptor ACE2. Fusion of the human IgG1 Fc to sdAbs improve their neutralization activity by up to ten times. These results support neutralizing sdAbs as a potential alternative for antiviral therapies. Here, using a humanized phage display library with recombinant SARS- CoV-2 receptor binding domain (RBD) proteins, the authors identify a number of single domain antibodies (sdAbs) that neutralize SARS-CoV-2 in vitro by inhibiting the interaction of the RDB with the host entry receptor ACE2."
c2a833f2b1d02de8e8f8d34865752591	https://www.biorxiv.org/content/10.1101/2020.12.09.417741v1	"Characterization of protease activity of Nsp3 from SARS-CoV-2 and its in vitro inhibition by nanobodies"	"Of the 16 non-structural proteins (Nsps) encoded by SARS CoV-2, Nsp3 is the largest and plays important roles in the viral life cycle. Being a large, multidomain, transmembrane protein, Nsp3 has been the most challenging Nsp to characterize. Encoded within Nsp3 is the papain-like protease PLpro domain that cleaves not only the viral protein but also polyubiquitin and the ubiquitin-like modifier ISG15 from host cells. We here compare the interactors of PLpro and Nsp3 and find a largely overlapping interactome. Intriguingly, we find that near full length Nsp3 is a more active protease compared to the minimal catalytic domain of PLpro. Using a MALDI-TOF based assay, we screen 1971 approved clinical compounds and identify five compounds that inhibit PLpro with IC50s in the low micromolar range but showed cross reactivity with other human deubiquitinases and had no significant antiviral activity in cellular SARS-CoV-2 infection assays. We therefore looked for alternative methods to block PLpro activity and engineered competitive nanobodies that bind to PLpro at the substrate binding site with nanomolar affinity thus inhibiting the enzyme. Our work highlights the importance of studying Nsp3 and provides tools and valuable insights to investigate Nsp3 biology during the viral infection cycle.\n\n### Competing Interest Statement\n\nThe authors have declared no competing interest."
58e948806573e43a6bfcac8a9c9f9f42	https://patents.google.com/patent/CN112062838A/en	"Neutralizing single-domain antibody for resisting novel coronavirus SARS-Cov-2 and application thereof \n       "	"\n     The invention relates to a neutralizing single-domain antibody for resisting novel coronavirus SARS-Cov-2 and application thereof. The antibody has at least one of a heavy chain CDR1, a heavy chain CDR2, and a heavy chain CDR 3. The antibody can be used for preparing a diagnostic reagent or a diagnostic kit, an antibody medicament or a pharmaceutical composition aiming at COVID-19. The invention obtains SARS-CoV-2 specificity fully human monoclonal single-domain antibody by phage display technology, has SARS-Cov-2 pseudovirus neutralization effect, and has synergistic neutralization effect on D614G mutant pseudovirus by combining with IgG type SARS-CoV-2 neutralizing antibody 4A 3; this provides an effective alternative antibody drug for the prevention and treatment of COVID-19. \n   \n   "
1bf9b8040d72cb17f8483c05c203e270	https://patents.google.com/patent/CN112062840A/en	"Nano antibody based on novel coronavirus S protein and application thereof \n     "	"\n     The invention belongs to the technical field of biological medicines, and particularly relates to a nano antibody based on a novel coronavirus S protein and application thereof. According to the invention, a nano antibody for the 2019 novel coronavirus is obtained by screening by using a nano antibody library and taking the Spike S1+ S2 ECD of the 2019 novel coronavirus as a target spot, and through ELISA detection, the nano antibody not only can specifically identify the Spike S1+ S2 ECD target spot of the 2019 novel coronavirus, but also can identify a Spike RBD target spot, and has a strong binding signal. Constructing a corresponding antibody sequence into a prokaryotic expression vector for expression and purification, successfully expressing a target antibody, wherein the purity of the purified target antibody is more than 90%; and VHH antibody ELISA detection shows that the purified nano antibody has higher affinity to both targets. \n     \n   "
a90cf7747f257a84094d714a6377d4fb	https://patents.google.com/patent/CN111875700A/en	"Single-chain antibody of anti SARS-COV-2 virus N protein and its use \n     "	"\n     The invention provides a single-chain antibody for resisting SARS-COV-2 virus N protein, the single-chain antibody can identify SARS-COV-2 virus N protein, the single-chain antibody includes heavy chain variable region and light chain variable region: the heavy chain variable region has the sequence shown in SEQ ID NO: 1-SEQ ID NO: 3, and three complementarity determining regions of the amino acid sequence set forth in seq id no; the light chain variable region has the sequence shown in SEQ ID NO: 4-SEQ ID NO: 6, and (b) three complementarity determining regions of the amino acid sequence set forth in figure 6. The EC50 of the single-chain antibody bound to the N protein is 1.339 ng/ml. The antibody can be used for quality control antibodies of a new crown antibody detection kit, the specificity of the antibody detected by a colloidal gold kit is good, and the concentration of the detected antibody is as low as 125 ng/ml. \n     \n   "
45da5d45b545143891111c2fbf9df6f7	https://patents.google.com/patent/CN111825762A/en	"Nano antibody of S protein RBD structure domain of anti SARS-COV-2 virus and its use \n       "	"\n     The invention provides a nano antibody for resisting an RBD structural domain of SARS-COV-2 virus S protein, which can identify the RBD structural domain of SARS-COV-2 virus S protein and comprises one or more than one of nano antibody 1-nano antibody 19; the nano antibody can be specifically combined with an S protein RBD region of SARS-COV-2, the combination of virus and a cell receptor ACE2 is blocked, and the EC50 of the combination of the antibody and the RBD is 0.4212 ng/ml-325.24 ng/ml. The nano antibody competes with a virus receptor ACE2 protein, and IC50 is 2.433 nM-100.02 nM. The invention also provides the use of the nano antibody and the recombinant antibody thereof in the preparation of drugs for inhibiting SARS-COV-2 virus infection, and the preparation of SARS-COV-2 virus detection test reagents or kits. \n     \n   "
e077a49d3f18f882b5ec487d6cb06008	https://www.nature.com/articles/s41467-020-19204-y	"Selection, biophysical and structural analysis of synthetic nanobodies that effectively neutralize SARS-CoV-2"	"The coronavirus SARS-CoV-2 is the cause of the ongoing COVID-19 pandemic. Therapeutic neutralizing antibodies constitute a key short-to-medium term approach to tackle COVID-19. However, traditional antibody production is hampered by long development times and costly production. Here, we report the rapid isolation and characterization of nanobodies from a synthetic library, known as sybodies (Sb), that target the receptor-binding domain (RBD) of the SARS-CoV-2 spike protein. Several binders with low nanomolar affinities and efficient neutralization activity were identified of which Sb23 displayed high affinity and neutralized pseudovirus with an IC50 of 0.6\u2009\u00b5g/ml. A cryo-EM structure of the spike bound to Sb23 showed that Sb23 binds competitively in the ACE2 binding site. Furthermore, the cryo-EM reconstruction revealed an unusual conformation of the spike where two RBDs are in the \u2018up\u2019 ACE2-binding conformation. The combined approach represents an alternative, fast workflow to select binders with neutralizing activity against newly emerging viruses. Here, the authors isolate several nanobodies from a synthetic library that bind the receptor-binding domain (RBD) of SARS-CoV-2 spike protein (S) and neutralize S pseudotyped viruses. Cryo-EM structure of Spike with one nanobody and further biophysical analysis shows competition with ACE2 binding."
a13845c93a85ddb20c728fcd00e59555	https://www.biorxiv.org/content/10.1101/2021.01.27.428466v1	"Synthetic nanobody\u2013SARS-CoV-2 receptor-binding domain structures identify distinct epitopes"	"The worldwide spread of severe acute respiratory syndrome coronavirus 2 (SARS-CoV-2) demands unprecedented attention. We report four X-ray crystal structures of three synthetic nanobodies (sybodies) (Sb16, Sb45 and Sb68) bind to the receptor-binding domain (RBD) of SARS-CoV-2: binary complexes of Sb16\u2013RBD and Sb45\u2013RBD; a ternary complex of Sb45\u2013RBD\u2013Sb68; and Sb16 unliganded. Sb16 and Sb45 bind the RBD at the ACE2 interface, positioning their CDR2 and CDR3 loops diametrically. Sb16 reveals a large CDR2 shift when binding the RBD. Sb68 interacts peripherally at the ACE2 interface; steric clashes with glycans explain its mechanism of viral neutralization. Superposing these structures onto trimeric spike (S) protein models indicates these sybodies bind conformations of the mature S protein differently, which may aid therapeutic design.\n\nOne Sentence Summary X-ray structures of synthetic nanobodies complexed with the receptor-binding domain of the spike protein of SARS-CoV-2 reveal details of CDR loop interactions in recognition of distinct epitopic sites.\n\n### Competing Interest Statement\n\nThe authors have declared no competing interest."
216ecb44fcf5978fded5e86222d90423	https://science.sciencemag.org/content/early/2020/11/04/science.abe4747	"Versatile and multivalent nanobodies efficiently neutralize SARS-CoV-2"	"Monoclonal antibodies that bind to the spike protein of severe acute respiratory syndrome coronavirus 2 (SARS-CoV-2) show therapeutic promise but must be produced in mammalian cells and need to be delivered intravenously. By contrast, single-domain antibodies called nanobodies can be produced in bacteria or yeast, and their stability may enable aerosol delivery. Two papers now report nanobodies that bind tightly to spike and efficiently neutralize SARS-CoV-2 in cells. Schoof et al. screened a yeast surface display of synthetic nanobodies and Xiang et al. screened anti-spike nanobodies produced by a llama. Both groups identified highly potent nanobodies that lock the spike protein in an inactive conformation. Multivalent constructs of selected nanobodies achieved even more potent neutralization.\n\nScience , this issue p. [1473][1], p. [1479][2]\n\nCost-effective, efficacious therapeutics are urgently needed to combat the COVID-19 pandemic. In this study, we used camelid immunization and proteomics to identify a large repertoire of highly potent neutralizing nanobodies (Nbs) to the severe acute respiratory syndrome coronavirus 2 (SARS-CoV-2) spike protein receptor binding domain (RBD). We discovered Nbs with picomolar to femtomolar affinities that inhibit viral infection at concentrations below the nanograms-per-milliliter level, and we determined a structure of one of the most potent Nbs in complex with the RBD. Structural proteomics and integrative modeling revealed multiple distinct and nonoverlapping epitopes and indicated an array of potential neutralization mechanisms. We bioengineered multivalent Nb constructs that achieved ultrahigh neutralization potency (half-maximal inhibitory concentration as low as 0.058 ng/ml) and may prevent mutational escape. These thermostable Nbs can be rapidly produced in bulk from microbes and resist lyophilization and aerosolization.\n\n [1]: /lookup/doi/10.1126/science.abe3255\n [2]: /lookup/doi/10.1126/science.abe4747"
9bddbf8c1d5dca8622ec317fb70231da	https://patents.google.com/patent/US10822379B1/en	"Molecules that bind to SARS-CoV-2 \n       "	"\n     This document provides methods and materials involved in binding a binder (e.g., an antibody, antigen binding fragment, and/or antibody domain) to a SARS-CoV-2 antigen. For example, binders (e.g., antibodies, antigen binding fragments, and antibody domains) that bind to a SARS-CoV-2 polypeptide and methods and materials for using one or more such binding molecules to treat a mammal (e.g., a human) having COVID-19 (or a viral infection caused by SARS-CoV-2) are provided. \n   \n   "
da3494fb2a836e23c61f9936366ac9d9	https://advances.sciencemag.org/content/4/8/eaas9667	"Chimeric camel/human heavy-chain antibodies protect against MERS-CoV infection"	"Middle East respiratory syndrome coronavirus (MERS-CoV) continues to cause outbreaks in humans as a result of spillover events from dromedaries. In contrast to humans, MERS-CoV\u2013exposed dromedaries develop only very mild infections and exceptionally potent virus-neutralizing antibody responses. These strong antibody responses may be caused by affinity maturation as a result of repeated exposure to the virus or by the fact that dromedaries\u2014apart from conventional antibodies\u2014have relatively unique, heavy chain\u2013only antibodies (HCAbs). These HCAbs are devoid of light chains and have long complementarity-determining regions with unique epitope binding properties, allowing them to recognize and bind with high affinity to epitopes not recognized by conventional antibodies. Through direct cloning and expression of the variable heavy chains (VHHs) of HCAbs from the bone marrow of MERS-CoV\u2013infected dromedaries, we identified several MERS-CoV\u2013specific VHHs or nanobodies. In vitro, these VHHs efficiently blocked virus entry at picomolar concentrations. The selected VHHs bind with exceptionally high affinity to the receptor binding domain of the viral spike protein. Furthermore, camel/human chimeric HCAbs\u2014composed of the camel VHH linked to a human Fc domain lacking the CH1 exon\u2014had an extended half-life in the serum and protected mice against a lethal MERS-CoV challenge. HCAbs represent a promising alternative strategy to develop novel interventions not only for MERS-CoV but also for other emerging pathogens."
25e008e5b375b688fb295042e7d9db83	https://www.biorxiv.org/content/10.1101/2020.11.11.378778v1	"Rapid generation of potent antibodies by autonomous hypermutation in yeast"	"The predominant approach for antibody generation remains animal immunization, which can yield exceptionally selective and potent antibody clones owing to the powerful evolutionary process of somatic hypermutation. However, animal immunization is inherently slow, has poor compatibility with certain antigens ( e . g ., integral membrane proteins), and suffers from self-tolerance and immunodominance, which limit the functional spectrum of antibodies that can be obtained. Here, we describe Autonomous Hypermutation yEast surfAce Display (AHEAD), a synthetic recombinant antibody generation technology that imitates somatic hypermutation inside engineered yeast. In AHEAD, antibody fragments are encoded on an error-prone orthogonal DNA replication system, resulting in Saccharomyces cerevisiae populations that continuously mutate surface-displayed antibody repertoires. Simple cycles of yeast culturing and enrichment for antigen binding drive the evolution of high-affinity antibody clones in a readily parallelizable process that takes as little as 2 weeks. We applied AHEAD to generate nanobodies against the SARS-CoV-2 S glycoprotein, a GPCR, and other targets. The SARS-CoV-2 nanobodies, concurrently evolved from an open-source na\u00efve nanobody library in 8 independent experiments, reached subnanomolar affinities through the sequential fixation of multiple mutations over 3-8 AHEAD cycles that saw \u223c580-fold and \u223c925-fold improvements in binding affinities and pseudovirus neutralization potencies, respectively. These experiments highlight the defining speed, parallelizability, and effectiveness of AHEAD and provide a template for streamlined antibody generation at large with salient utility in rapid response to current and future viral outbreaks.\n\n### Competing Interest Statement\n\nProvisional patents have been filed on this work, with A.W., C.M., A.C.K., and C.C.L. as co-inventors. A.C.K. is a co-founder and advisor of Tectonic Therapeutic, Inc., and of the Institute for Protein Innovation. C.C.L. is a co-founder of K2 Biotechnologies, Inc., which focuses on the use of continuous evolution technologies applied to antibody engineering."
3b190314c68df4ed405fabe98a907118	https://patents.google.com/patent/CN111647077A/en	"Novel coronavirus (SARS-COV-2) spike protein binding molecule and application thereof \n       "	"\n     The invention relates to the field of medical biotechnology, and particularly discloses a novel coronavirus (SARS-COV-2) spike protein binding molecule and application thereof. The binding molecule is capable of specifically binding to the spike protein of SARS-COV-2 and comprises at least one immunoglobulin single variable domain. The SARS-COV-2-Spike protein binding molecule provided by the invention can specifically bind to SARS-COV-2-Spike protein, and effectively block the binding of SARS-COV-2-Spike protein and human body cell ACE2 receptor, thereby blocking the infection process of SARS-COV-2 to cells and inhibiting the infection and amplification of SARS-COV-2. \n     \n   "
ba0e519311f4a1b2f5fdc4a2a22fb20e	https://patents.google.com/patent/CN111647076A/en	"Neutralizing single-domain antibody for resisting novel coronavirus SARS-Cov-2 and application thereof \n       "	"\n     The invention relates to a neutralizing single-domain antibody for resisting novel coronavirus SARS-Cov-2 and application thereof. The antibody has at least one of a heavy chain CDR1, a heavy chain CDR2, and a heavy chain CDR 3. The antibody can be used for preparing a diagnostic reagent or a diagnostic kit, an antibody medicament or a pharmaceutical composition aiming at COVID-19. The invention obtains the neutralizing single-domain antibody for resisting novel coronavirus SARS-Cov-2 by phage display technology, the antibody can block the combination of SARS-Cov-2-RBD and ACE2 positive cells, has obvious virus neutralizing effect on SARS-Cov-2 pseudovirus, and provides effective alternative antibody medicine for preventing and treating COVID-19. \n     \n   "
018be3fea84601a90ea29295ef8bc4f0	https://www.researchsquare.com/article/rs-105739/v1	"Development of Multivalent Nanobodies Blocking SARS CoV 2 Infection by Targeting RBD of Spike Protein"	"Background: The outbreak and pandemic of coronavirus SARS CoV 2 caused significant threaten to global public health and economic consequences. It is extremely urgent that global people must take actions to develop safe and effective preventions and therapeutics. Nanobodies, which are derived f..."
e5cb1560dd69d3a4cf8e10b768212132	http://doi.org/10.1093/nar/gks1342	"Nanobody\u00ae-based chromatin immunoprecipitation/micro-array analysis for genome-wide identification of transcription factor DNA binding sites"	"Abstract. Nanobodies\u00ae are single-domain antibody fragments derived from camelid heavy-chain antibodies. Because of their small size, straightforward production "
815e29742c9079ef261d3caeec468cbd	https://www.spandidos-publications.com/10.3892/or.2017.6131	"Screening and antitumor effect of an anti\u2011CTLA\u20114 nanobody"	""
